Sheet: Sheet1
B1: Czakon, Fiedler, Mitov, 2013 (arxiv:1303.6254)
A2: NNLO 8 TeV | C2: 173.3 | D2: GeV | E2: 245.794 | F2: pb | G2: Lumi | H2: of:=[.H5] -> 18.191607 | I2: /fb | J2: BR | K2: pXS [pb] | L2: BR MadGraph
C3: -1.1125 | D3: a1 | G3: SemiLep | H3: 19.712 | I3: /fb | J3: 0.456976 | K3: of:=[.$E$2]*[.J3] -> 112.321958944 | L3: of:=6/9*6/9 -> 0.444444444444444 | M3: of:=[.J3]/[.L3] -> 1.028196
C4: 0.70778 | D4: a2 | G4: AllJets | H4: 18.291 | I4: /fb | J4: 0.438048 | K4: of:=[.$E$2]*[.J4] -> 107.669570112 | L4: of:=1/9*6/9*6 -> 0.444444444444444 | M4: of:=[.J4]/[.L4] -> 0.985608
G5: AllJets2 | H5: 18.191607 | I5: /fb | J5: 0.104976 | K5: of:=[.$E$2]*[.J5] -> 25.802470944 | L5: of:=1/9 -> 0.111111111111111 | M5: of:=[.J5]/[.L5] -> 0.944784
A7: Z2* | B7: mt | C7: nevents | D7: Lumi [/fb] | E7: w /fb | F7: w for LUMI | G7: tt XS
A8: Hadronic | B8: 172.5 | C8: of:=31223821+10537444 -> 41761265 | D8: of:=[.C8]/[.$K$3]/1000/([.$C$2]/[.B8])^4*(1+[.$C$3]*([.B8]-[.$C$2])/[.$C$2]+[.$C$4]*(([.B8]-[.$C$2])/[.$C$2])^2) -> 366.861634311072 | E8: of:=1/[.D8] -> 0.0027258233254014 | F8: of:=[.$H$2]*[.E8] -> 0.0495871066871354 | H8: /TTJets_HadronicMGDecays_8TeV-madgraph/Summer12_DR53X-PU_S10_START53_V7A-v1/AODSIM & /TTJets_HadronicMGDecays_8TeV-madgraph/Summer12_DR53X-PU_S10_START53_V7A_ext-v1/AODSIM
A9: SemiLep | C9: 24953451 | D9: of:=[.C9]/[.$K$4]/1000/([.$C$2]/[.B8])^4*(1+[.$C$3]*([.B8]-[.$C$2])/[.$C$2]+[.$C$4]*(([.B8]-[.$C$2])/[.$C$2])^2) -> 228.68146036407 | E9: of:=1/[.D9] -> 0.00437289493607378 | F9: of:=[.$H$2]*[.E9] -> 0.0795499861293443 | H9: /TTJets_SemiLeptMGDecays_8TeV-madgraph-tauola/Summer12_DR53X-PU_S10_START53_V7C-v1/AODSIM
A10: FullLep | C10: 12011428 | D10: of:=[.C10]/[.$K$5]/1000/([.$C$2]/[.B8])^4*(1+[.$C$3]*([.B8]-[.$C$2])/[.$C$2]+[.$C$4]*(([.B8]-[.$C$2])/[.$C$2])^2) -> 459.331960394302 | E10: of:=1/[.D10] -> 0.00217707472204106 | F10: of:=[.$H$2]*[.E10] -> 0.0396044877530052 | H10: /TTJets_FullLeptMGDecays_8TeV-madgraph-tauola/Summer12_DR53X-PU_S10_START53_V7C-v2/AODSIM
A12: P11
A13: Hadronic | B13: 172.5 | C13: 11651739 | D13: of:=[.C13]/[.$K$3]/1000/([.$C$2]/[.B13])^4*(1+[.$C$3]*([.B13]-[.$C$2])/[.$C$2]+[.$C$4]*(([.B13]-[.$C$2])/[.$C$2])^2) -> 102.357436062008 | E13: of:=1/[.D13] -> 0.00976968590141516 | F13: of:=[.$H$2]*[.E13] -> 0.177726286431985 | H13: /TTJets_HadronicMGDecays_TuneP11_8TeV-madgraph-tauola/Summer12_DR53X-PU_S10_START53_V19-v1/AODSIM
A14: SemiLep | C14: 12005805 | D14: of:=[.C14]/[.$K$4]/1000/([.$C$2]/[.B13])^4*(1+[.$C$3]*([.B13]-[.$C$2])/[.$C$2]+[.$C$4]*(([.B13]-[.$C$2])/[.$C$2])^2) -> 110.025063076296 | E14: of:=1/[.D14] -> 0.00908883823412633 | F14: of:=[.$H$2]*[.E14] -> 0.1653405732418 | H14: /TTJets_SemiLeptMGDecays_TuneP11_8TeV-madgraph-tauola/Summer12_DR53X-PU_S10_START53_V19-v1/AODSIM
A15: FullLep | C15: 5976484 | D15: of:=[.C15]/[.$K$5]/1000/([.$C$2]/[.B13])^4*(1+[.$C$3]*([.B13]-[.$C$2])/[.$C$2]+[.$C$4]*(([.B13]-[.$C$2])/[.$C$2])^2) -> 228.548188607148 | E15: of:=1/[.D15] -> 0.00437544487267366 | F15: of:=[.$H$2]*[.E15] -> 0.0795963735738444 | H15: /TTJets_FullLeptMGDecays_TuneP11_8TeV-madgraph-tauola/Summer12_DR53X-PU_S10_START53_V19-v1/AODSIM
A17: P11mpiHi
A18: Hadronic | B18: 172.5 | C18: 7953758 | D18: of:=[.C18]/[.$K$3]/1000/([.$C$2]/[.B18])^4*(1+[.$C$3]*([.B18]-[.$C$2])/[.$C$2]+[.$C$4]*(([.B18]-[.$C$2])/[.$C$2])^2) -> 69.8716540026928 | E18: of:=1/[.D18] -> 0.0143119554599561 | F18: of:=[.$H$2]*[.E18] -> 0.260357469129025 | H18: /TTJets_HadronicMGDecays_TuneP11mpiHi_8TeV-madgraph-tauola/Summer12_DR53X-PU_S10_START53_V19-v1/AODSIM
A19: SemiLep | C19: 7978174 | D19: of:=[.C19]/[.$K$4]/1000/([.$C$2]/[.B18])^4*(1+[.$C$3]*([.B18]-[.$C$2])/[.$C$2]+[.$C$4]*(([.B18]-[.$C$2])/[.$C$2])^2) -> 73.1145556323515 | E19: of:=1/[.D19] -> 0.0136771671707668 | F19: of:=[.$H$2]*[.E19] -> 0.248809650043891 | H19: /TTJets_SemiLeptMGDecays_TuneP11mpiHi_8TeV-madgraph-tauola/Summer12_DR53X-PU_S10_START53_V19-v1/AODSIM
A20: FullLep | C20: 3982409 | D20: of:=[.C20]/[.$K$5]/1000/([.$C$2]/[.B18])^4*(1+[.$C$3]*([.B18]-[.$C$2])/[.$C$2]+[.$C$4]*(([.B18]-[.$C$2])/[.$C$2])^2) -> 152.292278075672 | E20: of:=1/[.D20] -> 0.00656632110725347 | F20: of:=[.$H$2]*[.E20] -> 0.11945193301896 | H20: /TTJets_FullLeptMGDecays_TuneP11mpiHi_8TeV-madgraph-tauola/Summer12_DR53X-PU_S10_START53_V19-v1/AODSIM
A22: P11TeV
A23: Hadronic | B23: 172.5 | C23: 7946264 | D23: of:=[.C23]/[.$K$3]/1000/([.$C$2]/[.B23])^4*(1+[.$C$3]*([.B23]-[.$C$2])/[.$C$2]+[.$C$4]*(([.B23]-[.$C$2])/[.$C$2])^2) -> 69.8058212007524 | E23: of:=1/[.D23] -> 0.0143254528461764 | F23: of:=[.$H$2]*[.E23] -> 0.260603008274673 | H23: /TTJets_HadronicMGDecays_TuneP11TeV_8TeV-madgraph-tauola/Summer12_DR53X-PU_S10_START53_V19-v1/AODSIM
A24: SemiLep | C24: 7853450 | D24: of:=[.C24]/[.$K$4]/1000/([.$C$2]/[.B23])^4*(1+[.$C$3]*([.B23]-[.$C$2])/[.$C$2]+[.$C$4]*(([.B23]-[.$C$2])/[.$C$2])^2) -> 71.97154473328 | E24: of:=1/[.D24] -> 0.0138943801151679 | F24: of:=[.$H$2]*[.E24] -> 0.252761102563749 | H24: /TTJets_SemiLeptMGDecays_TuneP11TeV_8TeV-madgraph-tauola/Summer12_DR53X-PU_S10_START53_V19-v1/AODSIM
A25: FullLep | C25: 3984963 | D25: of:=[.C25]/[.$K$5]/1000/([.$C$2]/[.B23])^4*(1+[.$C$3]*([.B23]-[.$C$2])/[.$C$2]+[.$C$4]*(([.B23]-[.$C$2])/[.$C$2])^2) -> 152.389946215284 | E25: of:=1/[.D25] -> 0.0065621126907367 | F25: of:=[.$H$2]*[.E25] -> 0.119375375159595 | H25: /TTJets_FullLeptMGDecays_TuneP11TeV_8TeV-madgraph-tauola/Summer12_DR53X-PU_S10_START53_V19-v1/AODSIM
A27: P11NoCR
A28: Hadronic | B28: 172.5 | C28: 11919063 | D28: of:=[.C28]/[.$K$3]/1000/([.$C$2]/[.B28])^4*(1+[.$C$3]*([.B28]-[.$C$2])/[.$C$2]+[.$C$4]*(([.B28]-[.$C$2])/[.$C$2])^2) -> 104.705806484469 | E28: of:=1/[.D28] -> 0.00955056871796627 | F28: of:=[.$H$2]*[.E28] -> 0.173740192743736 | H28: /TTJets_HadronicMGDecays_TuneP11noCR_8TeV-madgraph-tauola/Summer12_DR53X-PU_S10_START53_V19-v1/AODSIM
A29: SemiLep | C29: 12024653 | D29: of:=[.C29]/[.$K$4]/1000/([.$C$2]/[.B28])^4*(1+[.$C$3]*([.B28]-[.$C$2])/[.$C$2]+[.$C$4]*(([.B28]-[.$C$2])/[.$C$2])^2) -> 110.197792217646 | E29: of:=1/[.D29] -> 0.00907459196664262 | F29: of:=[.$H$2]*[.E29] -> 0.16508141074252 | H29: /TTJets_SemiLeptMGDecays_TuneP11noCR_8TeV-madgraph-tauola/Summer12_DR53X-PU_S10_START53_V19-v1/AODSIM
A30: FullLep | C30: 5974627 | D30: of:=[.C30]/[.$K$5]/1000/([.$C$2]/[.B28])^4*(1+[.$C$3]*([.B28]-[.$C$2])/[.$C$2]+[.$C$4]*(([.B28]-[.$C$2])/[.$C$2])^2) -> 228.477174615269 | E30: of:=1/[.D30] -> 0.0043768048238687 | F30: of:=[.$H$2]*[.E30] -> 0.0796211132715237 | H30: /TTJets_FullLeptMGDecays_TuneP11noCR_8TeV-madgraph-tauola/Summer12_DR53X-PU_S10_START53_V19-v1/AODSIM
A32: RD
A33: Hadronic | B33: 172.5 | C33: 31228390 | D33: of:=[.C33]/[.$K$3]/1000/([.$C$2]/[.B33])^4*(1+[.$C$3]*([.B33]-[.$C$2])/[.$C$2]+[.$C$4]*(([.B33]-[.$C$2])/[.$C$2])^2) -> 274.333121669172 | E33: of:=1/[.D33] -> 0.0036452032985136 | F33: of:=[.$H$2]*[.E33] -> 0.0663121058416631 | H33: /TTJets_HadronicMGDecays_8TeV-madgraph/Summer12_DR53X-PU_RD1_START53_V7N-v1/AODSIM
A34: SemiLep | C34: 24949110 | D34: of:=[.C34]/[.$K$4]/1000/([.$C$2]/[.B33])^4*(1+[.$C$3]*([.B33]-[.$C$2])/[.$C$2]+[.$C$4]*(([.B33]-[.$C$2])/[.$C$2])^2) -> 228.641678042201 | E34: of:=1/[.D34] -> 0.00437365579435359 | F34: of:=[.$H$2]*[.E34] -> 0.0795638273641533 | H34: /TTJets_SemiLeptMGDecays_8TeV-madgraph/Summer12_DR53X-PU_RD1_START53_V7N-v1/AODSIM
A35: FullLep | C35: 12116717 | D35: of:=[.C35]/[.$K$5]/1000/([.$C$2]/[.B33])^4*(1+[.$C$3]*([.B33]-[.$C$2])/[.$C$2]+[.$C$4]*(([.B33]-[.$C$2])/[.$C$2])^2) -> 463.358342834255 | E35: of:=1/[.D35] -> 0.0021581568897265 | F35: of:=[.$H$2]*[.E35] -> 0.0392603419822468 | H35: /TTJets_FullLeptMGDecays_8TeV-madgraph/Summer12_DR53X-PU_RD1_START53_V7N-v1/AODSIM
A37: MassiveB | B37: 172.5 | C37: 6923750 | D37: of:=[.C37]/[.$E$2]/1000/([.$C$2]/[.B37])^4*(1+[.$C$3]*([.B37]-[.$C$2])/[.$C$2]+[.$C$4]*(([.B37]-[.$C$2])/[.$C$2])^2) -> 27.7947915260406 | E37: of:=1/[.D37] -> 0.0359779636793863 | F37: of:=[.$H$2]*[.E37] -> 0.654496975915669 | H37: /TTJets_MassiveBinDECAY_TuneZ2star_8TeV-madgraph-tauola/Summer12_DR53X-PU_S10_START53_V7A-v1/AODSIM
C38: 45706206 | D38: of:=[.C38]/[.$E$2]/1000/([.$C$2]/[.B37])^4*(1+[.$C$3]*([.B37]-[.$C$2])/[.$C$2]+[.$C$4]*(([.B37]-[.$C$2])/[.$C$2])^2) -> 183.483584360536 | E38: of:=1/[.D38] -> 0.00545007883667156 | F38: of:=[.$H$2]*[.E38] -> 0.0991456923157461 | H38: /TTJets_MassiveBinDECAY_8TeV-madgraph-gridpack/Summer12_DR53X-PU_S10_START53_V19-v1/AODSIM
C39: of:=[.C38]+[.C37] -> 52629956 | D39: of:=[.C39]/[.$E$2]/1000/([.$C$2]/[.B37])^4*(1+[.$C$3]*([.B37]-[.$C$2])/[.$C$2]+[.$C$4]*(([.B37]-[.$C$2])/[.$C$2])^2) -> 211.278375886577 | E39: of:=1/[.D39] -> 0.00473309204410413 | F39: of:=[.$H$2]*[.E39] -> 0.086102550361169 | H39: /TTJets_MassiveBinDECAY_TuneZ2star_8TeV-madgraph-tauola/Summer12_DR53X-PU_S10_START53_V7A-v1/AODSIM & /TTJets_MassiveBinDECAY_8TeV-madgraph-gridpack/Summer12_DR53X-PU_S10_START53_V19-v1/AODSIM
A41: Width x5 | B41: 172.5 | C41: 13523421 | D41: of:=[.C41]/[.$E$2]/1000/([.$C$2]/[.B41])^4*(1+[.$C$3]*([.B41]-[.$C$2])/[.$C$2]+[.$C$4]*(([.B41]-[.$C$2])/[.$C$2])^2) -> 54.2885961240483 | E41: of:=1/[.D41] -> 0.01842007477436 | F41: of:=[.$H$2]*[.E41] -> 0.335090761205771 | H41: /TTJets_MSDecays_width_x5_TuneZ2star_8TeV-madgraph-tauola/Summer12_DR53X-PU_S10_START53_V19-v1/AODSIM
A43: 161_5 | B43: 161.5 | C43: 5369214 | D43: of:=[.C43]/[.$E$2]/1000/([.$C$2]/[.B43])^4*(1+[.$C$3]*([.B43]-[.$C$2])/[.$C$2]+[.$C$4]*(([.B43]-[.$C$2])/[.$C$2])^2) -> 17.7774494215083 | E43: of:=1/[.D43] -> 0.0562510389589485 | F43: of:=[.$H$2]*[.E43] -> 1.02329679408288 | H43: /TTJets_mass161_5_TuneZ2star_8TeV-madgraph-tauola/Summer12_DR53X-PU_S10_START53_V7A-v1/AODSIM
A44: 163_5 | B44: 163.5 | C44: 5365348 | D44: of:=[.C44]/[.$E$2]/1000/([.$C$2]/[.B44])^4*(1+[.$C$3]*([.B44]-[.$C$2])/[.$C$2]+[.$C$4]*(([.B44]-[.$C$2])/[.$C$2])^2) -> 18.4214645512314 | E44: of:=1/[.D44] -> 0.0542845004108619 | F44: of:=[.$H$2]*[.E44] -> 0.987522297665737 | H44: /TTJets_mass163_5_TuneZ2star_8TeV-madgraph-tauola/Summer12_DR53X-PU_S10_START53_V7A-v1/AODSIM
A45: 166_5 | B45: 166.5 | C45: 4469095 | D45: of:=[.C45]/[.$E$2]/1000/([.$C$2]/[.B45])^4*(1+[.$C$3]*([.B45]-[.$C$2])/[.$C$2]+[.$C$4]*(([.B45]-[.$C$2])/[.$C$2])^2) -> 16.185279814938 | E45: of:=1/[.D45] -> 0.0617845357901729 | F45: of:=[.$H$2]*[.E45] -> 1.12395999377226 | H45: /TTJets_mass166_5_TuneZ2star_8TeV-madgraph-tauola/Summer12_DR53X-PU_S10_START53_V7A-v1/AODSIM
A46: 169_5 | B46: 169.5 | C46: 5202817 | D46: of:=[.C46]/[.$E$2]/1000/([.$C$2]/[.B46])^4*(1+[.$C$3]*([.B46]-[.$C$2])/[.$C$2]+[.$C$4]*(([.B46]-[.$C$2])/[.$C$2])^2) -> 19.850120907541 | E46: of:=1/[.D46] -> 0.0503775269006096 | F46: of:=[.$H$2]*[.E46] -> 0.916448171007817 | H46: /TTJets_mass169_5_TuneZ2star_8TeV-madgraph-tauola/Summer12_DR53X-PU_S10_START53_V7A-v1/AODSIM
A47: 175_5 | B47: 175.5 | C47: 5186494 | D47: of:=[.C47]/[.$E$2]/1000/([.$C$2]/[.B47])^4*(1+[.$C$3]*([.B47]-[.$C$2])/[.$C$2]+[.$C$4]*(([.B47]-[.$C$2])/[.$C$2])^2) -> 21.8821431122157 | E47: of:=1/[.D47] -> 0.0456993629404494 | F47: of:=[.$H$2]*[.E47] -> 0.83134485076302 | H47: /TTJets_mass175_5_TuneZ2star_8TeV-madgraph-tauola/Summer12_DR53X-PU_S10_START53_V7A-v1/AODSIM
A48: 178_5 | B48: 178.5 | C48: 4733483 | D48: of:=[.C48]/[.$E$2]/1000/([.$C$2]/[.B48])^4*(1+[.$C$3]*([.B48]-[.$C$2])/[.$C$2]+[.$C$4]*(([.B48]-[.$C$2])/[.$C$2])^2) -> 20.9657078789887 | E48: of:=1/[.D48] -> 0.0476969347170087 | F48: of:=[.$H$2]*[.E48] -> 0.867683891476478 | H48: /TTJets_mass178_5_TuneZ2star_8TeV-madgraph-tauola/Summer12_DR53X-PU_S10_START53_V7A-v1/AODSIM
A49: 181_5 | B49: 181.5 | C49: 5145140 | D49: of:=[.C49]/[.$E$2]/1000/([.$C$2]/[.B49])^4*(1+[.$C$3]*([.B49]-[.$C$2])/[.$C$2]+[.$C$4]*(([.B49]-[.$C$2])/[.$C$2])^2) -> 23.8989649162039 | E49: of:=1/[.D49] -> 0.0418428163523511 | F49: of:=[.$H$2]*[.E49] -> 0.761188070855144 | H49: /TTJets_mass181_5_TuneZ2star_8TeV-madgraph-tauola/Summer12_DR53X-PU_S10_START53_V7A-v1/AODSIM
A50: 184_5 | B50: 184.5 | C50: 5249525 | D50: of:=[.C50]/[.$E$2]/1000/([.$C$2]/[.B50])^4*(1+[.$C$3]*([.B50]-[.$C$2])/[.$C$2]+[.$C$4]*(([.B50]-[.$C$2])/[.$C$2])^2) -> 25.5456287379358 | E50: of:=1/[.D50] -> 0.0391456405422106 | F50: of:=[.$H$2]*[.E50] -> 0.712122108507161 | H50: /TTJets_mass184_5_TuneZ2star_8TeV-madgraph-tauola/Summer12_DR53X-PU_S10_START53_V7A-v1/AODSIM
A52: Scale Up | B52: 172.5 | C52: 5009488 | D52: of:=[.C52]/[.$E$2]/1000/([.$C$2]/[.B52])^4*(1+[.$C$3]*([.B52]-[.$C$2])/[.$C$2]+[.$C$4]*(([.B52]-[.$C$2])/[.$C$2])^2) -> 20.1101534012929 | E52: of:=1/[.D52] -> 0.0497261249104001 | F52: of:=[.$H$2]*[.E52] -> 0.904598122002909 | H52: /TTJets_scaleup_TuneZ2star_8TeV-madgraph-tauola/Summer12_DR53X-PU_S10_START53_V7A-v1/AODSIM
A53: Scale Down | B53: 172.5 | C53: 5387181 | D53: of:=[.C53]/[.$E$2]/1000/([.$C$2]/[.B53])^4*(1+[.$C$3]*([.B53]-[.$C$2])/[.$C$2]+[.$C$4]*(([.B53]-[.$C$2])/[.$C$2])^2) -> 21.62636906417 | E53: of:=1/[.D53] -> 0.0462398471529266 | F53: of:=[.$H$2]*[.E53] -> 0.84117712714611 | H53: /TTJets_scaledown_TuneZ2star_8TeV-madgraph-tauola/Summer12_DR53X-PU_S10_START53_V7A-v1/AODSIM
A54: Match Up | B54: 172.5 | C54: 5415010 | D54: of:=[.C54]/[.$E$2]/1000/([.$C$2]/[.B54])^4*(1+[.$C$3]*([.B54]-[.$C$2])/[.$C$2]+[.$C$4]*(([.B54]-[.$C$2])/[.$C$2])^2) -> 21.7380861616068 | E54: of:=1/[.D54] -> 0.0460022097881907 | F54: of:=[.$H$2]*[.E54] -> 0.836854121598318 | H54: /TTJets_matchingup_TuneZ2star_8TeV-madgraph-tauola/Summer12_DR53X-PU_S10_START53_V7A-v1/AODSIM
A55: Match Down | B55: 172.5 | C55: 5476728 | D55: of:=[.C55]/[.$E$2]/1000/([.$C$2]/[.B55])^4*(1+[.$C$3]*([.B55]-[.$C$2])/[.$C$2]+[.$C$4]*(([.B55]-[.$C$2])/[.$C$2])^2) -> 21.9858476988379 | E55: of:=1/[.D55] -> 0.045483804568193 | F55: of:=[.$H$2]*[.E55] -> 0.827423497569372 | H55: /TTJets_matchingdown_TuneZ2star_8TeV-madgraph-tauola/Summer12_DR53X-PU_S10_START53_V7A-v1/AODSIM
A57: MadSpin | B57: 172.5 | C57: 62131965 | D57: of:=[.C57]/[.$E$2]/1000/([.$C$2]/[.B57])^4*(1+[.$C$3]*([.B57]-[.$C$2])/[.$C$2]+[.$C$4]*(([.B57]-[.$C$2])/[.$C$2])^2) -> 249.423363679834 | E57: of:=1/[.D57] -> 0.00400924751092534 | F57: of:=[.$H$2]*[.E57] -> 0.0729346550844821 | H57: /TTJets_MSDecays_central_TuneZ2star_8TeV-madgraph-tauola/Summer12_DR53X-PU_S10_START53_V19-v1/AODSIM
A59: 166_5 MadSpin | B59: 166.5 | C59: 27078777 | D59: of:=[.C59]/[.$E$2]/1000/([.$C$2]/[.B59])^4*(1+[.$C$3]*([.B59]-[.$C$2])/[.$C$2]+[.$C$4]*(([.B59]-[.$C$2])/[.$C$2])^2) -> 98.0685312778778 | E59: of:=1/[.D59] -> 0.0101969509175833 | F59: of:=[.$H$2]*[.E59] -> 0.185498923690964 | H59: /TTJets_MSDecays_mass166_5_TuneZ2star_8TeV-madgraph-tauola/Summer12_DR53X-PU_S10_START53_V19-v1/AODSIM
A60: 169_5 MadSpin | B60: 169.5 | C60: 39518234 | D60: of:=[.C60]/[.$E$2]/1000/([.$C$2]/[.B60])^4*(1+[.$C$3]*([.B60]-[.$C$2])/[.$C$2]+[.$C$4]*(([.B60]-[.$C$2])/[.$C$2])^2) -> 150.772499388792 | E60: of:=1/[.D60] -> 0.00663250927094689 | F60: of:=[.$H$2]*[.E60] -> 0.120656002080922 | H60: /TTJets_MSDecays_mass169_5_TuneZ2star_8TeV-madgraph-tauola/Summer12_DR53X-PU_S10_START53_V19-v1/AODSIM
A61: 171_5 MadSpin | B61: 171.5 | C61: 24439341 | D61: of:=[.C61]/[.$E$2]/1000/([.$C$2]/[.B61])^4*(1+[.$C$3]*([.B61]-[.$C$2])/[.$C$2]+[.$C$4]*(([.B61]-[.$C$2])/[.$C$2])^2) -> 96.4723346369327 | E61: of:=1/[.D61] -> 0.0103656660094672 | F61: of:=[.$H$2]*[.E61] -> 0.188568122337486 | H61: /TTJets_MSDecays_mass171_5_TuneZ2star_8TeV-madgraph-tauola/Summer12_DR53X-PU_S10_START53_V19-v1/AODSIM
A62: 173_5 MadSpin | B62: 173.5 | C62: 26489020 | D62: of:=[.C62]/[.$E$2]/1000/([.$C$2]/[.B62])^4*(1+[.$C$3]*([.B62]-[.$C$2])/[.$C$2]+[.$C$4]*(([.B62]-[.$C$2])/[.$C$2])^2) -> 108.128639914434 | E62: of:=1/[.D62] -> 0.009248243580899 | F62: of:=[.$H$2]*[.E62] -> 0.168240412663987 | H62: /TTJets_MSDecays_mass173_5_TuneZ2star_8TeV-madgraph-tauola/Summer12_DR53X-PU_S10_START53_V19-v1/AODSIM
A63: 175_5 MadSpin | B63: 175.5 | C63: 40244328 | D63: of:=[.C63]/[.$E$2]/1000/([.$C$2]/[.B63])^4*(1+[.$C$3]*([.B63]-[.$C$2])/[.$C$2]+[.$C$4]*(([.B63]-[.$C$2])/[.$C$2])^2) -> 169.793341079918 | E63: of:=1/[.D63] -> 0.00588951247227841 | F63: of:=[.$H$2]*[.E63] -> 0.107139696317287 | H63: /TTJets_MSDecays_mass175_5_TuneZ2star_8TeV-madgraph-tauola/Summer12_DR53X-PU_S10_START53_V19-v1/AODSIM
A64: 178_5 MadSpin | B64: 178.5 | C64: 24359161 | D64: of:=[.C64]/[.$E$2]/1000/([.$C$2]/[.B64])^4*(1+[.$C$3]*([.B64]-[.$C$2])/[.$C$2]+[.$C$4]*(([.B64]-[.$C$2])/[.$C$2])^2) -> 107.892444887466 | E64: of:=1/[.D64] -> 0.00926848956887597 | F64: of:=[.$H$2]*[.E64] -> 0.168608719720591 | H64: /TTJets_MSDecays_mass178_5_TuneZ2star_8TeV-madgraph-tauola/Summer12_DR53X-PU_S10_START53_V19-v1/AODSIM
A66: MS Scale Up | B66: 172.5 | C66: 41908271 | D66: of:=[.C66]/[.$E$2]/1000/([.$C$2]/[.B66])^4*(1+[.$C$3]*([.B66]-[.$C$2])/[.$C$2]+[.$C$4]*(([.B66]-[.$C$2])/[.$C$2])^2) -> 168.237104988166 | E66: of:=1/[.D66] -> 0.00594399196342771 | F66: of:=[.$H$2]*[.E66] -> 0.108130765809835 | H66: /TTJets_MSDecays_scaleup_TuneZ2star_8TeV-madgraph-tauola/Summer12_DR53X-PU_S10_START53_V19-v1/AODSIM
A67: MS Scale Down | B67: 172.5 | C67: 39286663 | D67: of:=[.C67]/[.$E$2]/1000/([.$C$2]/[.B67])^4*(1+[.$C$3]*([.B67]-[.$C$2])/[.$C$2]+[.$C$4]*(([.B67]-[.$C$2])/[.$C$2])^2) -> 157.712887934835 | E67: of:=1/[.D67] -> 0.00634063590550184 | F67: of:=[.$H$2]*[.E67] -> 0.115346356522979 | H67: /TTJets_MSDecays_scaledown_TuneZ2star_8TeV-madgraph-tauola/Summer12_DR53X-PU_S10_START53_V19-v1/AODSIM
A68: MS Match Up | B68: 172.5 | C68: 37083003 | D68: of:=[.C68]/[.$E$2]/1000/([.$C$2]/[.B68])^4*(1+[.$C$3]*([.B68]-[.$C$2])/[.$C$2]+[.$C$4]*(([.B68]-[.$C$2])/[.$C$2])^2) -> 148.866486736889 | E68: of:=1/[.D68] -> 0.00671742862963796 | F68: of:=[.$H$2]*[.E68] -> 0.122200821680922 | H68: /TTJets_MSDecays_matchingup_TuneZ2star_8TeV-madgraph-tauola/Summer12_DR53X-PU_S10_START53_V19-v2/AODSIM
A69: MS Match Down | B69: 172.5 | C69: of:=13406551+20646562 -> 34053113 | D69: of:=[.C69]/[.$E$2]/1000/([.$C$2]/[.B69])^4*(1+[.$C$3]*([.B69]-[.$C$2])/[.$C$2]+[.$C$4]*(([.B69]-[.$C$2])/[.$C$2])^2) -> 136.703257143557 | E69: of:=1/[.D69] -> 0.00731511465706969 | F69: of:=[.$H$2]*[.E69] -> 0.133073691001352 | H69: /TTJets_MSDecays_matchingdown_TuneZ2star_8TeV-madgraph-tauola/Summer12_DR53X-PU_S10_START53_V19-v1/AODSIM & /TTJets_MSDecays_matchingdown_TuneZ2star_8TeV-madgraph-tauola/Summer12_DR53X-PU_S10_START53_V19-v2/AODSIM
A71: Pow+Pyt | B71: 172.5 | C71: 21675970 | D71: of:=[.C71]/[.$E$2]/1000/([.$C$2]/[.B71])^4*(1+[.$C$3]*([.B71]-[.$C$2])/[.$C$2]+[.$C$4]*(([.B71]-[.$C$2])/[.$C$2])^2) -> 87.0162942444065 | E71: of:=1/[.D71] -> 0.0114921005161545 | F71: of:=[.$H$2]*[.E71] -> 0.209059776194381 | H71: /TT_CT10_TuneZ2star_8TeV-powheg-tauola/Summer12_DR53X-PU_S10_START53_V7A-v2/AODSIM
A72: Pow+Her | B72: 172.5 | C72: 27684235 | D72: of:=[.C72]/[.$E$2]/1000/([.$C$2]/[.B72])^4*(1+[.$C$3]*([.B72]-[.$C$2])/[.$C$2]+[.$C$4]*(([.B72]-[.$C$2])/[.$C$2])^2) -> 111.135950948968 | E72: of:=1/[.D72] -> 0.00899798842283886 | F72: of:=[.$H$2]*[.E72] -> 0.163687869178834 | H72: /TT_CT10_AUET2_8TeV-powheg-herwig/Summer12_DR53X-PU_S10_START53_V19-v1/AODSIM
A73: MCNLO | B73: 172.5 | C73: 32852589 | D73: of:=[.C73]/[.$E$2]/1000/([.$C$2]/[.B73])^4*(1+[.$C$3]*([.B73]-[.$C$2])/[.$C$2]+[.$C$4]*(([.B73]-[.$C$2])/[.$C$2])^2) -> 131.883858074843 | E73: of:=1/[.D73] -> 0.00758242907507687 | F73: of:=[.$H$2]*[.E73] -> 0.137936569839172 | H73: /TT_8TeV-mcatnlo/Summer12_DR53X-PU_S10_START53_V7A-v1/AODSIM
A75: FSR145 | B75: 172.5 | C75: 64220697 | D75: of:=[.C75]/[.$E$2]/1000/([.$C$2]/[.B75])^4*(1+[.$C$3]*([.B75]-[.$C$2])/[.$C$2]+[.$C$4]*(([.B75]-[.$C$2])/[.$C$2])^2) -> 257.808396428528 | E75: of:=1/[.D75] -> 0.00387884961798453 | F75: of:=[.$H$2]*[.E75] -> 0.0705625078624748
A76: FSR290 | B76: 172.5 | C76: 60507383 | D76: of:=[.C76]/[.$E$2]/1000/([.$C$2]/[.B76])^4*(1+[.$C$3]*([.B76]-[.$C$2])/[.$C$2]+[.$C$4]*(([.B76]-[.$C$2])/[.$C$2])^2) -> 242.90162069273 | E76: of:=1/[.D76] -> 0.00411689307443937 | F76: of:=[.$H$2]*[.E76] -> 0.0748929008712228
B77: 172.5 | D77: of:=[.C77]/[.$E$2]/1000/([.$C$2]/[.B77])^4*(1+[.$C$3]*([.B77]-[.$C$2])/[.$C$2]+[.$C$4]*(([.B77]-[.$C$2])/[.$C$2])^2) -> 0 | E77: of:=1/[.D77] -> 0 | F77: of:=[.$H$2]*[.E77] -> 0
A79: FastSim width | B79: 172.5 | C79: 10000000 | D79: of:=[.C79]/[.$E$2]/1000/([.$C$2]/[.B79])^4*(1+[.$C$3]*([.B79]-[.$C$2])/[.$C$2]+[.$C$4]*(([.B79]-[.$C$2])/[.$C$2])^2) -> 40.1441293028208 | E79: of:=1/[.D79] -> 0.024910242602515 | F79: of:=[.$H$2]*[.E79] -> 0.453157343699611
Q83: xs
C84: 50129518 | D84: of:=[.C84]/[.Q84]/1000 -> 0.00483875656370656 | E84: of:=1/[.D84] -> 206.664664120648 | F84: of:=[.$H$2]*[.E84] -> 3759.56235046984 | H84: /QCD_HT-100To250_TuneZ2star_8TeV-madgraph-pythia/Summer12_DR53X-PU_S10_START53_V7A-v1/AODSIM | Q84: 10360000
C85: 27062078 | D85: of:=[.C85]/[.Q85]/1000 -> 0.0980510072463768 | E85: of:=1/[.D85] -> 10.1987733536205 | F85: of:=[.$H$2]*[.E85] -> 185.532076731136 | H85: /QCD_HT-250To500_TuneZ2star_8TeV-madgraph-pythia6/Summer12_DR53X-PU_S10_START53_V7A-v1/AODSIM | Q85: 276000
C86: 30599292 | D86: of:=[.C86]/[.Q86]/1000 -> 3.63153239971517 | E86: of:=1/[.D86] -> 0.275365848334007 | F86: of:=[.$H$2]*[.E86] -> 5.00934729411387 | H86: /QCD_HT-500To1000_TuneZ2star_8TeV-madgraph-pythia6/Summer12_DR53X-PU_S10_START53_V7A-v1/AODSIM | Q86: 8426
C87: 13843863 | D87: of:=[.C87]/[.Q87]/1000 -> 67.8620735294118 | E87: of:=1/[.D87] -> 0.014735771366706 | F87: of:=[.$H$2]*[.E87] -> 0.268067361544968 | H87: /QCD_HT-1000ToInf_TuneZ2star_8TeV-madgraph-pythia6/Summer12_DR53X-PU_S10_START53_V7A-v1/AODSIM | Q87: 204
C89: 45991 | D89: of:=[.C89]/[.Q89]/1000 -> 0.0048230030957155 | E89: of:=1/[.D89] -> 207.339696897219 | F89: of:=[.$H$2]*[.E89] -> 3771.84228145333 | H89: /QCD6Jets_Pt-100to180_TuneZ2Star_8TeV-alpgen/Summer12_DR53X-PU_S10_START53_V19-v1/AODSIM | Q89: 9535.76
C90: 36994 | D90: of:=[.C90]/[.Q90]/1000 -> 0.0193172086805773 | E90: of:=1/[.D90] -> 51.7673136184246 | F90: of:=[.$H$2]*[.E90] -> 941.730624792129 | H90: /QCD6Jets_Pt-180to250_TuneZ2Star_8TeV-alpgen/Summer12_DR53X-PU_S10_START53_V19-v1/AODSIM | Q90: 1915.08
C91: 66997 | D91: of:=[.C91]/[.Q91]/1000 -> 0.08838654353562 | E91: of:=1/[.D91] -> 11.3139394301237 | F91: of:=[.$H$2]*[.E91] -> 205.818739734615 | H91: /QCD6Jets_Pt-250to400_TuneZ2Star_8TeV-alpgen/Summer12_DR53X-PU_S10_START53_V19-v1/AODSIM | Q91: 758
C92: 46997 | D92: of:=[.C92]/[.Q92]/1000 -> 0.458654981603833 | E92: of:=1/[.D92] -> 2.18028810349597 | F92: of:=[.$H$2]*[.E92] -> 39.662944325574 | H92: /QCD6Jets_Pt-400to5600_TuneZ2Star_8TeV-alpgen/Summer12_DR53X-PU_S10_START53_V19-v1/AODSIM | Q92: 102.467
C94: of:=40884011+16825894 -> 57709905 | D94: of:=[.C94]/[.Q94]/1000 -> 1.59169001847919 | E94: of:=1/[.D94] -> 0.628263033876074 | F94: of:=[.$H$2]*[.E94] -> 11.4291142049012 | H94: /WJetsToLNu_TuneZ2Star_8TeV-madgraph-tarball/Summer12_DR53X-PU_S10_START53_V7A-v2/AODSIM | Q94: 36257 | S94: nob | T94: baseline | U94: final | V94: nob frac | W94: baseline frac | X94: final frac
C95: 42931500 | D95: of:=[.C95]/[.Q95]/1000 -> 1.59168807101511 | E95: of:=1/[.D95] -> 0.628263802569209 | F95: of:=[.$H$2]*[.E95] -> 11.4291281886646 | H95: /WJetsToLNu_TuneZ2Star_8TeV-madgraph-tarball/Summer12_DR53X-PU_S10_START53_V7A-v2/AODSIM | P95: 0.74392 | Q95: of:=[.$Q$94]*[.P95] -> 26972.30744 | S95: 399.062255859375 | T95: 0 | U95: 0 | V95: of:=[.S95]/SUM([.$S$95:.$S$99]) -> 0.00465848330179161 | W95: of:=[.T95]/SUM([.$T$95:.$T$99]) -> 0 | X95: of:=[.U95]/SUM([.$U$95:.$U$99]) -> 0
C96: 23141598 | D96: of:=[.C96]/[.Q96]/1000 -> 3.62673609739899 | E96: of:=1/[.D96] -> 0.275730015403431 | F96: of:=[.$H$2]*[.E96] -> 5.01597207832316 | G96: n | H96: /W1JetsToLNu_TuneZ2Star_8TeV-madgraph/Summer12_DR53X-PU_S10_START53_V7A-v1/AODSIM | P96: 0.175989 | Q96: of:=[.$Q$94]*[.P96] -> 6380.833173 | S96: 841.609558105469 | T96: 52.4797210693359 | U96: 0 | V96: of:=[.S96]/SUM([.$S$95:.$S$99]) -> 0.00982459256794289 | W96: of:=[.T96]/SUM([.$T$95:.$T$99]) -> 0.0119641928399709 | X96: of:=[.U96]/SUM([.$U$95:.$U$99]) -> 0
C97: 34044921 | D97: of:=[.C97]/[.Q97]/1000 -> 16.6827262008216 | E97: of:=1/[.D97] -> 0.0599422413316806 | F97: of:=[.$H$2]*[.E97] -> 1.09044569700509 | G97: n | H97: /W2JetsToLNu_TuneZ2Star_8TeV-madgraph/Summer12_DR53X-PU_S10_START53_V7A-v1/AODSIM | P97: 0.0562851 | Q97: of:=[.$Q$94]*[.P97] -> 2040.7288707 | S97: 1729.38500976562 | T97: 109.627754211426 | U97: 12.4759702682495 | V97: of:=[.S97]/SUM([.$S$95:.$S$99]) -> 0.0201881061715865 | W97: of:=[.T97]/SUM([.$T$95:.$T$99]) -> 0.0249926555490938 | X97: of:=[.U97]/SUM([.$U$95:.$U$99]) -> 0.0477644584592761
C98: 15539503 | D98: of:=[.C98]/[.Q98]/1000 -> 25.3766101618322 | E98: of:=1/[.D98] -> 0.0394063664777438 | F98: of:=[.$H$2]*[.E98] -> 0.71686513226109 | G98: n | H98: /W3JetsToLNu_TuneZ2Star_8TeV-madgraph/Summer12_DR53X-PU_S10_START53_V7A-v1/AODSIM | P98: 0.0168893 | Q98: of:=[.$Q$94]*[.P98] -> 612.3553501 | S98: 4496.82177734375 | T98: 182.880676269531 | U98: 11.0237150192261 | V98: of:=[.S98]/SUM([.$S$95:.$S$99]) -> 0.0524939877257414 | W98: of:=[.T98]/SUM([.$T$95:.$T$99]) -> 0.0416926697209798 | X98: of:=[.U98]/SUM([.$U$95:.$U$99]) -> 0.0422044752256852
C99: 13382803 | D99: of:=[.C99]/[.Q99]/1000 -> 53.3621937784702 | E99: of:=1/[.D99] -> 0.0187398592372614 | F99: of:=[.$H$2]*[.E99] -> 0.34090815447958 | G99: n | H99: /W4JetsToLNu_TuneZ2Star_8TeV-madgraph/Summer12_DR53X-PU_S10_START53_V7A-v1/AODSIM | P99: 0.00691706 | Q99: of:=[.$Q$94]*[.P99] -> 250.79184442 | S99: 78196.6796875 | T99: 4041.41064453125 | U99: 237.698089599609 | V99: of:=[.S99]/SUM([.$S$95:.$S$99]) -> 0.912834830232938 | W99: of:=[.T99]/SUM([.$T$95:.$T$99]) -> 0.921350481889955 | X99: of:=[.U99]/SUM([.$U$95:.$U$99]) -> 0.910031066315039
E101: of:=1/[.D101] -> 0 | H101: scaleup | R101: var/default
P102: 0.789626 | R102: of:=[.P102]/[.$P$95] -> 1.06143940208625
P103: 0.154636 | R103: of:=[.P103]/[.$P$96] -> 0.878668553148208
P104: 0.0412414 | R104: of:=[.P104]/[.$P$97] -> 0.73272322515195
P105: 0.0106544 | R105: of:=[.P105]/[.$P$98] -> 0.630837275671579
P106: 0.00384176 | R106: of:=[.P106]/[.$P$99] -> 0.555403596325607
E108: of:=1/[.D108] -> 0 | H108: scaledown
P109: 0.670316 | R109: of:=[.P109]/[.$P$95] -> 0.901059253683192
P110: 0.202541 | R110: of:=[.P110]/[.$P$96] -> 1.15087306593026
P111: 0.0811985 | R111: of:=[.P111]/[.$P$97] -> 1.44262868858721
P112: 0.0304637 | R112: of:=[.P112]/[.$P$98] -> 1.80372780399424
P113: 0.0154811 | R113: of:=[.P113]/[.$P$99] -> 2.23810404998655
E115: of:=1/[.D115] -> 0 | H115: matchingup
P116: 0.857024 | R116: of:=[.P116]/[.$P$95] -> 1.15203785353264
P117: 0.108299 | R117: of:=[.P117]/[.$P$96] -> 0.615373688128235
P118: 0.0235024 | R118: of:=[.P118]/[.$P$97] -> 0.41755988707491
P119: 0.00695762 | R119: of:=[.P119]/[.$P$98] -> 0.411954314269982
P120: 0.00421767 | R120: of:=[.P120]/[.$P$99] -> 0.609748939578376
E122: of:=1/[.D122] -> 0 | H122: matchingdown
P123: 0.668407 | R123: of:=[.P123]/[.$P$95] -> 0.89849311753952
P124: 0.21319 | R124: of:=[.P124]/[.$P$96] -> 1.21138252958992
P125: 0.0771958 | R125: of:=[.P125]/[.$P$97] -> 1.37151395307106
P126: 0.0266328 | R126: of:=[.P126]/[.$P$98] -> 1.57690372010681
P127: 0.014574 | R127: of:=[.P127]/[.$P$99] -> 2.10696451960804
G128: DESY?
C129: 20646001 | D129: of:=[.C129]/[.Q129]/1000 -> 54.7058850026497 | E129: of:=1/[.D129] -> 0.0182795690070925 | F129: of:=[.$H$2]*[.E129] -> 0.332534735506406 | G129: n | H129: /WbbJetsToLNu_Massive_TuneZ2star_8TeV-madgraph-pythia6_tauola/Summer12_DR53X-PU_S10_START53_V7A-v1/AODSIM | Q129: 377.4
C130: 30459503 | D130: of:=[.C130]/[.Q130]/1000 -> 8.69352484516369 | E130: of:=1/[.D130] -> 0.115028140807156 | F130: of:=[.$H$2]*[.E130] -> 2.09254673150445 | H130: /DYJetsToLL_M-50_TuneZ2Star_8TeV-madgraph-tarball/Summer12_DR53X-PU_S10_START53_V7A-v1/AODSIM | Q130: 3503.7
C131: 10000431 | D131: of:=[.C131]/[.Q131]/1000 -> 182.489616788321 | E131: of:=1/[.D131] -> 0.00547976382217926 | F131: of:=[.$H$2]*[.E131] -> 0.0996857099059031 | H131: /WW_TuneZ2star_8TeV_pythia6_tauola/Summer12_DR53X-PU_S10_START53_V7A-v1/AODSIM | Q131: 54.8
C132: 10000283 | D132: of:=[.C132]/[.Q132]/1000 -> 301.213343373494 | E132: of:=1/[.D132] -> 0.00331990604665888 | F132: of:=[.$H$2]*[.E132] -> 0.060394426077742 | H132: /WZ_TuneZ2star_8TeV_pythia6_tauola/Summer12_DR53X-PU_S10_START53_V7A-v1/AODSIM | Q132: 33.2
C133: 9799908 | D133: of:=[.C133]/[.Q133]/1000 -> 1209.86518518519 | E133: of:=1/[.D133] -> 0.000826538371584713 | F133: of:=[.$H$2]*[.E133] -> 0.0150360612262891 | H133: /ZZ_TuneZ2star_8TeV_pythia6_tauola/Summer12_DR53X-PU_S10_START53_V7A-v1/AODSIM | Q133: 8.1
C134: 210160 | D134: of:=[.C134]/[.Q134]/1000 -> 1021.68206125425 | E134: of:=1/[.D134] -> 0.000978778073848497 | F134: of:=[.$H$2]*[.E134] -> 0.0178055460596688 | H134: /TTZJets_8TeV-madgraph_v2/Summer12_DR53X-PU_S10_START53_V7A-v1/AODSIM | Q134: 0.2057
C135: 196046 | D135: of:=[.C135]/[.Q135]/1000 -> 845.025862068965 | E135: of:=1/[.D135] -> 0.00118339573365435 | F135: of:=[.$H$2]*[.E135] -> 0.0215278701121165 | H135: /TTWJets_8TeV-madgraph/Summer12_DR53X-PU_S10_START53_V7A-v1/AODSIM | Q135: 0.232
C137: 21484602 | D137: of:=[.C137]/[.Q137]/1000 -> 0.159523329373329 | E137: of:=1/[.D137] -> 6.26867558449535 | F137: of:=[.$H$2]*[.E137] -> 114.037282643635 | H137: /QCD_Pt_20_MuEnrichedPt_15_TuneZ2star_8TeV_pythia6/Summer12_DR53X-PU_S10_START53_V7A-v3/AODSIM | Q137: 134680
C138: 1740229 | D138: of:=[.C138]/[.Q138]/1000 -> 0.0103963784739647 | E138: of:=1/[.D138] -> 96.1873408614613 | F138: of:=[.$H$2]*[.E138] -> 1749.80230332675 | H138: /QCD_Pt_20_30_BCtoE_TuneZ2star_8TeV_pythia6/Summer12_DR53X-PU_S10_START53_V7A-v1/AODSIM | Q138: of:=288600000*0.00058 -> 167388
C139: 2048152 | D139: of:=[.C139]/[.Q139]/1000 -> 0.0122614463601533 | E139: of:=1/[.D139] -> 81.5564469824505 | F139: of:=[.$H$2]*[.E139] -> 1483.64283182108 | H139: /QCD_Pt_30_80_BCtoE_TuneZ2star_8TeV_pythia6/Summer12_DR53X-PU_S10_START53_V7A-v1/AODSIM | Q139: of:=74240000*0.00225 -> 167040
C140: 1945525 | D140: of:=[.C140]/[.Q140]/1000 -> 0.149864426624762 | E140: of:=1/[.D140] -> 6.67269760090464 | F140: of:=[.$H$2]*[.E140] -> 121.3870923855 | H140: /QCD_Pt_80_170_BCtoE_TuneZ2star_8TeV_pythia6/Summer12_DR53X-PU_S10_START53_V7A-v1/AODSIM | Q140: of:=1191000*0.0109 -> 12981.9
C141: 1948112 | D141: of:=[.C141]/[.Q141]/1000 -> 3.08245569620253 | E141: of:=1/[.D141] -> 0.324416665982243 | F141: of:=[.$H$2]*[.E141] -> 5.90166049179924 | G141: n | H141: /QCD_Pt_170_250_BCtoE_TuneZ2star_8TeV_pythia6/Summer12_DR53X-PU_S10_START53_V7A-v1/AODSIM | Q141: 632
C142: 2026521 | D142: of:=[.C142]/[.Q142]/1000 -> 19.6749611650485 | E142: of:=1/[.D142] -> 0.0508260215413509 | F142: of:=[.$H$2]*[.E142] -> 0.92460700925379 | G142: n | H142: /QCD_Pt_250_350_BCtoE_TuneZ2star_8TeV_pythia6/Summer12_DR53X-PU_S10_START53_V7A-v1/AODSIM | Q142: 103
C143: 1948532 | D143: of:=[.C143]/[.Q143]/1000 -> 81.5285355648536 | E143: of:=1/[.D143] -> 0.0122656440848803 | F143: of:=[.$H$2]*[.E143] -> 0.223131776794017 | G143: n | H143: /QCD_Pt_350_BCtoE_TuneZ2star_8TeV_pythia6/Summer12_DR53X-PU_S10_START53_V7A-v2/AODSIM | Q143: 23.9
C144: 35040695 | D144: of:=[.C144]/[.Q144]/1000 -> 0.0120414759450172 | E144: of:=1/[.D144] -> 83.0462980257669 | F144: of:=[.$H$2]*[.E144] -> 1510.74561648963 | H144: /QCD_Pt_20_30_EMEnriched_TuneZ2star_8TeV_pythia6/Summer12_DR53X-PU_S10_START53_V7A-v1/AODSIM | Q144: 2910000
C145: 33088888 | D145: of:=[.C145]/[.Q145]/1000 -> 0.00719323652173913 | E145: of:=1/[.D145] -> 139.019479893069 | F145: of:=[.$H$2]*[.E145] -> 2528.98774355911 | H145: /QCD_Pt_30_80_EMEnriched_TuneZ2star_8TeV_pythia6/Summer12_DR53X-PU_S10_START53_V7A-v1/AODSIM | Q145: 4600000
C146: 34542763 | D146: of:=[.C146]/[.Q146]/1000 -> 0.188758267759563 | E146: of:=1/[.D146] -> 5.29778118791482 | F146: of:=[.$H$2]*[.E146] -> 96.3751533425395 | H146: /QCD_Pt_80_170_EMEnriched_TuneZ2star_8TeV_pythia6/Summer12_DR53X-PU_S10_START53_V7A-v1/AODSIM | Q146: 183000
C147: 31697066 | D147: of:=[.C147]/[.Q147]/1000 -> 6.91019533464138 | E147: of:=1/[.D147] -> 0.144713709464466 | F147: of:=[.$H$2]*[.E147] -> 2.63257493008974 | H147: /QCD_Pt_170_250_EMEnriched_TuneZ2star_8TeV_pythia6/Summer12_DR53X-PU_S10_START53_V7A-v1/AODSIM | Q147: 4587
C148: 34611322 | D148: of:=[.C148]/[.Q148]/1000 -> 62.1388186714542 | E148: of:=1/[.D148] -> 0.0160929998570988 | F148: of:=[.$H$2]*[.E148] -> 0.292757528851397 | H148: /QCD_Pt_250_350_EMEnriched_TuneZ2star_8TeV_pythia6/Summer12_DR53X-PU_S10_START53_V7A-v1/AODSIM | Q148: 557
C149: 34080562 | D149: of:=[.C149]/[.Q149]/1000 -> 382.497890011223 | E149: of:=1/[.D149] -> 0.00261439350677374 | F149: of:=[.$H$2]*[.E149] -> 0.0475600192185798 | H149: /QCD_Pt_350_EMEnriched_TuneZ2star_8TeV_pythia6/Summer12_DR53X-PU_S10_START53_V7A-v1/AODSIM | Q149: 89.1
C151: 259961 | D151: of:=[.C151]/[.Q151]/1000 -> 68.5912928759894 | E151: of:=1/[.D151] -> 0.0145791099434146 | F151: of:=[.$H$2]*[.E151] -> 0.26521743850039 | H151: /T_s-channel_TuneZ2star_8TeV-powheg-tauola/Summer12_DR53X-PU_S10_START53_V7A-v1/AODSIM | Q151: 3.79
C152: 3758227 | D152: of:=[.C152]/[.Q152]/1000 -> 66.6352304964539 | E152: of:=1/[.D152] -> 0.015007076475157 | F152: of:=[.$H$2]*[.E152] -> 0.273002837455002 | H152: /T_t-channel_TuneZ2star_8TeV-powheg-tauola/Summer12_DR53X-PU_S10_START53_V7A-v1/AODSIM | Q152: 56.4
C153: 497658 | D153: of:=[.C153]/[.Q153]/1000 -> 44.834054054054 | E153: of:=1/[.D153] -> 0.0223044741569512 | F153: of:=[.$H$2]*[.E153] -> 0.405754228204912 | H153: /T_tW-channel-DR_TuneZ2star_8TeV-powheg-tauola/Summer12_DR53X-PU_S10_START53_V7A-v1/AODSIM | Q153: 11.1
C154: 139974 | D154: of:=[.C154]/[.Q154]/1000 -> 79.5306818181818 | E154: of:=1/[.D154] -> 0.0125737636989727 | F154: of:=[.$H$2]*[.E154] -> 0.228736967722577 | H154: /Tbar_s-channel_TuneZ2star_8TeV-powheg-tauola/Summer12_DR53X-PU_S10_START53_V7A-v1/AODSIM | Q154: 1.76
C155: 1935072 | D155: of:=[.C155]/[.Q155]/1000 -> 63.031661237785 | E155: of:=1/[.D155] -> 0.0158650427477634 | F155: of:=[.$H$2]*[.E155] -> 0.288610622705512 | H155: /Tbar_t-channel_TuneZ2star_8TeV-powheg-tauola/Summer12_DR53X-PU_S10_START53_V7A-v1/AODSIM | Q155: 30.7
C156: 493460 | D156: of:=[.C156]/[.Q156]/1000 -> 44.4558558558559 | E156: of:=1/[.D156] -> 0.0224942244558829 | F156: of:=[.$H$2]*[.E156] -> 0.409206091071211 | H156: /Tbar_tW-channel-DR_TuneZ2star_8TeV-powheg-tauola/Summer12_DR53X-PU_S10_START53_V7A-v1/AODSIM | Q156: 11.1
C158: 2971482 | D158: of:=[.C158]/[.Q158]/1000 -> 2550.1169894174 | E158: of:=1/[.D158] -> 0.000392138872118357 | F158: of:=[.$H$2]*[.E158] -> 0.00713363625100041 | G158: n | H158: /TBarToDilepton_tW-channel-DR_8TeV-powheg-tauola/Summer12_DR53X-PU_S10_START53_V7A-v1/AODSIM | Q158: 1.1652336
C159: 1999667 | D159: of:=[.C159]/[.Q159]/1000 -> 3506.71120931538 | E159: of:=1/[.D159] -> 0.000285167480385484 | F159: of:=[.$H$2]*[.E159] -> 0.00518765473235294 | G159: n | H159: /TBarToLeptons_s-channel_8TeV-powheg-tauola/Summer12_DR53X-PU_S10_START53_V7A-v1/AODSIM | Q159: 0.57024
C160: 1711403 | D160: of:=[.C160]/[.Q160]/1000 -> 172.055635983432 | E160: of:=1/[.D160] -> 0.00581207348590601 | F160: of:=[.$H$2]*[.E160] -> 0.105730956710722 | G160: n | H160: /TBarToLeptons_t-channel_8TeV-powheg-tauola/Summer12_DR53X-PU_S10_START53_V7A-v1/AODSIM | Q160: 9.9468
C161: 1492919 | D161: of:=[.C161]/[.Q161]/1000 -> 614.075202750416 | E161: of:=1/[.D161] -> 0.00162846504063516 | F161: of:=[.$H$2]*[.E161] -> 0.0296243960324738 | G161: n | H161: /TBarToThadWlep_tW-channel-DR_8TeV-powheg-tauola/Summer12_DR53X-PU_S10_START53_V7A-v1/AODSIM | Q161: 2.4311664
C162: 1466488 | D162: of:=[.C162]/[.Q162]/1000 -> 603.20346645133 | E162: of:=1/[.D162] -> 0.00165781540660408 | F162: of:=[.$H$2]*[.E162] -> 0.0301583263554866 | G162: n | H162: /TBarToTlepWhad_tW-channel-DR_8TeV-powheg-tauola/Summer12_DR53X-PU_S10_START53_V7A-v1/AODSIM | Q162: 2.4311664
C163: 2976510 | D163: of:=[.C163]/[.Q163]/1000 -> 2554.43200402048 | E163: of:=1/[.D163] -> 0.000391476460687181 | F163: of:=[.$H$2]*[.E163] -> 0.00712158592257214 | G163: n | H163: /TToDilepton_tW-channel-DR_8TeV-powheg-tauola/Summer12_DR53X-PU_S10_START53_V7A-v1/AODSIM | Q163: 1.1652336
C164: 3932710 | D164: of:=[.C164]/[.Q164]/1000 -> 3202.63689370989 | E164: of:=1/[.D164] -> 0.000312242702869014 | F164: of:=[.$H$2]*[.E164] -> 0.00568019653921087 | G164: n | H164: /TToLeptons_s-channel_8TeV-powheg-tauola/Summer12_DR53X-PU_S10_START53_V7A-v1/AODSIM | Q164: 1.22796
C165: 3915598 | D165: of:=[.C165]/[.Q165]/1000 -> 223.799611339735 | E165: of:=1/[.D165] -> 0.00446828300555879 | F165: of:=[.$H$2]*[.E165] -> 0.0812852484019044 | H165: /TToLeptons_t-channel_8TeV-powheg-tauola/Summer12_DR53X-PU_S10_START53_V7A-v1/AODSIM | Q165: 17.496
C166: 1457622 | D166: of:=[.C166]/[.Q166]/1000 -> 599.556657248965 | E166: of:=1/[.D166] -> 0.00166789908494795 | F166: of:=[.$H$2]*[.E166] -> 0.0303417646690327 | G166: n | H166: /TToThadWlep_tW-channel-DR_8TeV-powheg-tauola/Summer12_DR53X-PU_S10_START53_V7A-v1/AODSIM | Q166: 2.4311664
C167: 1490110 | D167: of:=[.C167]/[.Q167]/1000 -> 612.919790270218 | E167: of:=1/[.D167] -> 0.00163153485313165 | F167: of:=[.$H$2]*[.E167] -> 0.0296802408549737 | G167: n | H167: /TToTlepWhad_tW-channel-DR_8TeV-powheg-tauola/Summer12_DR53X-PU_S10_START53_V7A-v1/AODSIM | Q167: 2.4311664
C169: 1492534 | D169: of:=[.C169]/[.Q169]/1000 -> 1280.88822704735 | E169: of:=1/[.D169] -> 0.000780708245172304 | F169: of:=[.$H$2]*[.E169] -> 0.0142023375778342 | H169: /TBarToDilepton_tW-channel-DR_scaleup_8TeV-powheg-tauola/Summer12_DR53X-PU_S10_START53_V7A-v1/AODSIM | Q169: 1.1652336
C170: 999812 | D170: of:=[.C170]/[.Q170]/1000 -> 1753.31790123457 | E170: of:=1/[.D170] -> 0.000570347225278352 | F170: of:=[.$H$2]*[.E170] -> 0.0103755325758043 | G170: n | H170: /TBarToLeptons_s-channel_scaleup_8TeV-powheg-tauola/Summer12_DR53X-PU_S10_START53_V7A-v1/AODSIM | Q170: 0.57024
C171: 979898 | D171: of:=[.C171]/[.Q171]/1000 -> 98.5138939156312 | E171: of:=1/[.D171] -> 0.0101508524356617 | F171: of:=[.$H$2]*[.E171] -> 0.18466031822455 | G171: n | H171: /TBarToLeptons_t-channel_scaleup_8TeV-powheg-tauola/Summer12_DR53X-PU_S10_START53_V7A-v1/AODSIM | Q171: 9.9468
C172: 497676 | D172: of:=[.C172]/[.Q172]/1000 -> 204.706679065653 | E172: of:=1/[.D172] -> 0.0048850384587563 | F172: of:=[.$H$2]*[.E172] -> 0.0888666998215803 | H172: /TBarToThadWlep_tW-channel-DR_scaleup_8TeV-powheg-tauola/Summer12_DR53X-PU_S10_START53_V7A-v1/AODSIM | Q172: 2.4311664
C173: 497376 | D173: of:=[.C173]/[.Q173]/1000 -> 204.583281506358 | E173: of:=1/[.D173] -> 0.00488798494499131 | F173: of:=[.$H$2]*[.E173] -> 0.0889203011411986 | H173: /TBarToTlepWhad_tW-channel-DR_scaleup_8TeV-powheg-tauola/Summer12_DR53X-PU_S10_START53_V7A-v1/AODSIM | Q173: 2.4311664
C174: 1492816 | D174: of:=[.C174]/[.Q174]/1000 -> 1281.13023860623 | E174: of:=1/[.D174] -> 0.00078056076569383 | F174: of:=[.$H$2]*[.E174] -> 0.0141996546891212 | G174: n | H174: /TToDilepton_tW-channel-DR_scaleup_8TeV-powheg-tauola/Summer12_DR53X-PU_S10_START53_V7A-v1/AODSIM | Q174: 1.1652336
C175: 1998845 | D175: of:=[.C175]/[.Q175]/1000 -> 1627.776963419 | E175: of:=1/[.D175] -> 0.000614334778334488 | F175: of:=[.$H$2]*[.E175] -> 0.0111757368538931 | G175: n | H175: /TToLeptons_s-channel_scaleup_8TeV-powheg-tauola/Summer12_DR53X-PU_S10_START53_V7A-v1/AODSIM | Q175: 1.22796
C176: 1945116 | D176: of:=[.C176]/[.Q176]/1000 -> 111.174897119342 | E176: of:=1/[.D176] -> 0.00899483629768096 | F176: of:=[.$H$2]*[.E176] -> 0.163630526956747 | G176: n | H176: /TToLeptons_t-channel_scaleup_8TeV-powheg-tauola/Summer12_DR53X-PU_S10_START53_V7A-v1/AODSIM | Q176: 17.496
C177: 455270 | D177: of:=[.C177]/[.Q177]/1000 -> 187.264022734108 | E177: of:=1/[.D177] -> 0.00534005403387001 | F177: of:=[.$H$2]*[.E177] -> 0.0971441643429279 | H177: /TToThadWlep_tW-channel-DR_scaleup_8TeV-powheg-tauola/Summer12_DR53X-PU_S10_START53_V7A-v1/AODSIM | Q177: 2.4311664
C178: 442237 | D178: of:=[.C178]/[.Q178]/1000 -> 181.903221433136 | E178: of:=1/[.D178] -> 0.00549742875426525 | F178: of:=[.$H$2]*[.E178] -> 0.100007063408093 | G178: n | H178: /TToTlepWhad_tW-channel-DR_scaleup_8TeV-powheg-tauola/Summer12_DR53X-PU_S10_START53_V7A-v1/AODSIM | Q178: 2.4311664
C180: 1493101 | D180: of:=[.C180]/[.Q180]/1000 -> 1281.37482475617 | E180: of:=1/[.D180] -> 0.000780411773885357 | F180: of:=[.$H$2]*[.E180] -> 0.0141969442886953 | G180: n | H180: /TBarToDilepton_tW-channel-DR_scaledown_8TeV-powheg-tauola/Summer12_DR53X-PU_S10_START53_V7A-v1/AODSIM | Q180: 1.1652336
C181: 999849 | D181: of:=[.C181]/[.Q181]/1000 -> 1753.38278619529 | E181: of:=1/[.D181] -> 0.000570326119244006 | F181: of:=[.$H$2]*[.E181] -> 0.0103751486231221 | G181: n | H181: /TBarToLeptons_s-channel_scaledown_8TeV-powheg-tauola/Summer12_DR53X-PU_S10_START53_V7A-v1/AODSIM | Q181: 0.57024
C182: 979359 | D182: of:=[.C182]/[.Q182]/1000 -> 98.4597056339728 | E182: of:=1/[.D182] -> 0.0101564390586087 | F182: of:=[.$H$2]*[.E182] -> 0.18476194787366 | G182: n | H182: /TBarToLeptons_t-channel_scaledown_8TeV-powheg-tauola/Summer12_DR53X-PU_S10_START53_V7A-v1/AODSIM | Q182: 9.9468
C183: 497682 | D183: of:=[.C183]/[.Q183]/1000 -> 204.709147016839 | E183: of:=1/[.D183] -> 0.00488497956526457 | F183: of:=[.$H$2]*[.E183] -> 0.0888656284543239 | H183: /TBarToThadWlep_tW-channel-DR_scaledown_8TeV-powheg-tauola/Summer12_DR53X-PU_S10_START53_V7A-v1/AODSIM | Q183: 2.4311664
C184: 497674 | D184: of:=[.C184]/[.Q184]/1000 -> 204.705856415258 | E184: of:=1/[.D184] -> 0.00488505809023578 | F184: of:=[.$H$2]*[.E184] -> 0.0888670569497398 | H184: /TBarToTlepWhad_tW-channel-DR_scaledown_8TeV-powheg-tauola/Summer12_DR53X-PU_S10_START53_V7A-v1/AODSIM | Q184: 2.4311664
C185: 1493130 | D185: of:=[.C185]/[.Q185]/1000 -> 1281.39971246967 | E185: of:=1/[.D185] -> 0.000780396616503587 | F185: of:=[.$H$2]*[.E185] -> 0.014196668551563 | H185: /TToDilepton_tW-channel-DR_scaledown_8TeV-powheg-tauola/Summer12_DR53X-PU_S10_START53_V7A-v1/AODSIM | Q185: 1.1652336
C186: 1945749 | D186: of:=[.C186]/[.Q186]/1000 -> 1584.53776995993 | E186: of:=1/[.D186] -> 0.000631098872465051 | F186: of:=[.$H$2]*[.E186] -> 0.0114807026660273 | G186: n | H186: /TToLeptons_s-channel_scaledown_8TeV-powheg-tauola/Summer12_DR53X-PU_S10_START53_V7A-v1/AODSIM | Q186: 1.22796
C187: 1951907 | D187: of:=[.C187]/[.Q187]/1000 -> 111.563042981253 | E187: of:=1/[.D187] -> 0.00896354180808819 | F187: of:=[.$H$2]*[.E187] -> 0.16306122990081 | G187: n | H187: /TToLeptons_t-channel_scaledown_8TeV-powheg-tauola/Summer12_DR53X-PU_S10_START53_V7A-v1/AODSIM | Q187: 17.496
C188: 496818 | D188: of:=[.C188]/[.Q188]/1000 -> 204.35376204607 | E188: of:=1/[.D188] -> 0.00489347487409876 | F188: of:=[.$H$2]*[.E188] -> 0.0890201717739792 | H188: /TToThadWlep_tW-channel-DR_scaledown_8TeV-powheg-tauola/Summer12_DR53X-PU_S10_START53_V7A-v1/AODSIM | Q188: 2.4311664
C189: 453233 | D189: of:=[.C189]/[.Q189]/1000 -> 186.426153306495 | E189: of:=1/[.D189] -> 0.00536405425024215 | F189: of:=[.$H$2]*[.E189] -> 0.0975807668470848 | H189: /TToTlepWhad_tW-channel-DR_scaledown_8TeV-powheg-tauola/Summer12_DR53X-PU_S10_START53_V7A-v1/AODSIM | Q189: 2.4311664
C191: 196046 | D191: of:=[.C191]/[.Q191]/1000 -> 845.025862068965 | E191: of:=1/[.D191] -> 0.00118339573365435 | F191: of:=[.$H$2]*[.E191] -> 0.0215278701121165 | H191: /TTWJets_8TeV-madgraph/Summer12_DR53X-PU_S10_START53_V7A-v1/AODSIM | Q191: 0.232
C192: 210160 | D192: of:=[.C192]/[.Q192]/1000 -> 1021.68206125425 | E192: of:=1/[.D192] -> 0.000978778073848497 | F192: of:=[.$H$2]*[.E192] -> 0.0178055460596688 | H192: /TTZJets_8TeV-madgraph_v2/Summer12_DR53X-PU_S10_START53_V7A-v1/AODSIM | Q192: 0.2057
C193: of:=71598+1719954 -> 1791552 | D193: of:=[.C193]/[.Q193]/1000 -> 995.306666666667 | E193: of:=1/[.D193] -> 0.00100471546458043 | F193: of:=[.$H$2]*[.E193] -> 0.0182773888784696 | H193: /TTGJets_8TeV-madgraph/Summer12_DR53X-PU_S10_START53_V7A-v1/AODSIM & /TTGJets_8TeV-madgraph/Summer12_DR53X-PU_S10_START53_V19-v1/AODSIM | Q193: 1.8